{
  "$schema": "https://raw.githubusercontent.com/MelonSmasher/noli-models/main/claude-models.schema.json",
  "schema_version": 1,
  "catalog_version": 1,
  "published": "2026-10-28",
  "source": "Claude Code 2.1.309 baked catalog C4r (chunk-eqkryfm7.js orig 240723103) and published catalog seed v2844, with lifecycle from https://platform.claude.com/docs/en/about-claude/model-deprecations",
  "defaults": {
    "main": "claude-opus-5-5",
    "small_fast": "claude-haiku-5-5",
    "verify": "claude-haiku-4-5-20251001",
    "best": "fable",
    "families": {
      "opus": "claude-opus-5-5",
      "sonnet": "claude-sonnet-5-5",
      "haiku": "claude-haiku-5-5",
      "fable": "claude-fable-5-1"
    },
    "latest_per_family": {
      "fable": "claude-fable-5-1",
      "opus": "claude-opus-5-5",
      "sonnet": "claude-sonnet-5-5",
      "haiku": "claude-haiku-5-5"
    }
  },
  "models": [
    {
      "id": "claude-fable-5-1",
      "display_name": "Claude Fable 5.1",
      "family": "fable",
      "aliases": [],
      "status": "active",
      "retirement": null,
      "replacement": null,
      "context_window": 1000000,
      "max_context_window": null,
      "max_output_tokens": 128000,
      "default_max_tokens": 64000,
      "thinking": {
        "supported": true,
        "adaptive": true,
        "budget_tokens": true,
        "disabled": false,
        "interleaved": true,
        "display": true
      },
      "effort": {
        "levels": [
          "low",
          "medium",
          "high",
          "xhigh",
          "max"
        ],
        "default": "high"
      },
      "sampling": {
        "temperature": false,
        "top_p": false
      },
      "inputs": {
        "image": true,
        "file": true
      },
      "structured_outputs": true,
      "strict_tools": true,
      "context_management": true,
      "conversation": {
        "tool_changes": true,
        "effort_changes": true,
        "per_turn_control": false,
        "system_clear_at": false
      },
      "pricing": {
        "input": 10,
        "output": 50,
        "cache_read": 0.25,
        "cache_write_5m": 12.5,
        "cache_write_1h": 20,
        "web_search": 0.01,
        "long_context": null
      }
    },
    {
      "id": "claude-fable-5",
      "display_name": "Claude Fable 5",
      "family": "fable",
      "aliases": [],
      "status": "active",
      "retirement": null,
      "replacement": null,
      "context_window": 1000000,
      "max_context_window": null,
      "max_output_tokens": 128000,
      "default_max_tokens": 64000,
      "thinking": {
        "supported": true,
        "adaptive": true,
        "budget_tokens": true,
        "disabled": false,
        "interleaved": true,
        "display": true
      },
      "effort": {
        "levels": [
          "low",
          "medium",
          "high",
          "xhigh",
          "max"
        ],
        "default": "high"
      },
      "sampling": {
        "temperature": false,
        "top_p": false
      },
      "inputs": {
        "image": true,
        "file": true
      },
      "structured_outputs": true,
      "strict_tools": true,
      "context_management": true,
      "conversation": {
        "tool_changes": true,
        "effort_changes": false,
        "per_turn_control": false,
        "system_clear_at": false
      },
      "pricing": {
        "input": 10,
        "output": 50,
        "cache_read": 1,
        "cache_write_5m": 12.5,
        "cache_write_1h": 20,
        "web_search": 0.01,
        "long_context": null
      }
    },
    {
      "id": "claude-mythos-5-1",
      "display_name": "Claude Mythos 5.1",
      "family": "mythos",
      "aliases": [],
      "status": "active",
      "retirement": null,
      "replacement": null,
      "context_window": 1000000,
      "max_context_window": null,
      "max_output_tokens": 128000,
      "default_max_tokens": 64000,
      "thinking": {
        "supported": true,
        "adaptive": true,
        "budget_tokens": true,
        "disabled": false,
        "interleaved": true,
        "display": true
      },
      "effort": {
        "levels": [
          "low",
          "medium",
          "high",
          "xhigh",
          "max"
        ],
        "default": "high"
      },
      "sampling": {
        "temperature": false,
        "top_p": false
      },
      "inputs": {
        "image": true,
        "file": true
      },
      "structured_outputs": true,
      "strict_tools": true,
      "context_management": true,
      "conversation": {
        "tool_changes": true,
        "effort_changes": false,
        "per_turn_control": false,
        "system_clear_at": false
      },
      "pricing": {
        "input": 10,
        "output": 50,
        "cache_read": 0.25,
        "cache_write_5m": 12.5,
        "cache_write_1h": 20,
        "web_search": 0.01,
        "long_context": null
      }
    },
    {
      "id": "claude-mythos-5",
      "display_name": "Claude Mythos 5",
      "family": "mythos",
      "aliases": [],
      "status": "active",
      "retirement": null,
      "replacement": null,
      "context_window": 1000000,
      "max_context_window": null,
      "max_output_tokens": 128000,
      "default_max_tokens": 64000,
      "thinking": {
        "supported": true,
        "adaptive": true,
        "budget_tokens": true,
        "disabled": false,
        "interleaved": true,
        "display": true
      },
      "effort": {
        "levels": [
          "low",
          "medium",
          "high",
          "xhigh",
          "max"
        ],
        "default": null
      },
      "sampling": {
        "temperature": false,
        "top_p": false
      },
      "inputs": {
        "image": true,
        "file": true
      },
      "structured_outputs": true,
      "strict_tools": true,
      "context_management": true,
      "conversation": {
        "tool_changes": false,
        "effort_changes": false,
        "per_turn_control": false,
        "system_clear_at": false
      },
      "pricing": {
        "input": 10,
        "output": 50,
        "cache_read": 1,
        "cache_write_5m": 12.5,
        "cache_write_1h": 20,
        "web_search": 0.01,
        "long_context": null
      }
    },
    {
      "id": "claude-opus-5-5",
      "display_name": "Claude Opus 5.5",
      "family": "opus",
      "aliases": [],
      "status": "active",
      "retirement": null,
      "replacement": null,
      "context_window": 1000000,
      "max_context_window": null,
      "max_output_tokens": 128000,
      "default_max_tokens": 128000,
      "thinking": {
        "supported": true,
        "adaptive": true,
        "budget_tokens": true,
        "disabled": false,
        "interleaved": true,
        "display": true
      },
      "effort": {
        "levels": [
          "low",
          "medium",
          "high",
          "xhigh",
          "max"
        ],
        "default": "medium"
      },
      "sampling": {
        "temperature": false,
        "top_p": false
      },
      "inputs": {
        "image": true,
        "file": true
      },
      "structured_outputs": true,
      "strict_tools": true,
      "context_management": true,
      "conversation": {
        "tool_changes": true,
        "effort_changes": true,
        "per_turn_control": false,
        "system_clear_at": false
      },
      "pricing": {
        "input": 4,
        "output": 20,
        "cache_read": 0.2,
        "cache_write_5m": 5,
        "cache_write_1h": 8,
        "web_search": 0.01,
        "long_context": null
      }
    },
    {
      "id": "claude-opus-5",
      "display_name": "Claude Opus 5",
      "family": "opus",
      "aliases": [],
      "status": "active",
      "retirement": null,
      "replacement": null,
      "context_window": 1000000,
      "max_context_window": null,
      "max_output_tokens": 128000,
      "default_max_tokens": 64000,
      "thinking": {
        "supported": true,
        "adaptive": true,
        "budget_tokens": true,
        "disabled": true,
        "interleaved": true,
        "display": true
      },
      "effort": {
        "levels": [
          "low",
          "medium",
          "high",
          "xhigh",
          "max"
        ],
        "default": "high"
      },
      "sampling": {
        "temperature": false,
        "top_p": false
      },
      "inputs": {
        "image": true,
        "file": true
      },
      "structured_outputs": true,
      "strict_tools": true,
      "context_management": true,
      "conversation": {
        "tool_changes": true,
        "effort_changes": false,
        "per_turn_control": false,
        "system_clear_at": false
      },
      "pricing": {
        "input": 5,
        "output": 25,
        "cache_read": 0.5,
        "cache_write_5m": 6.25,
        "cache_write_1h": 10,
        "web_search": 0.01,
        "long_context": null
      }
    },
    {
      "id": "claude-opus-4-8",
      "display_name": "Claude Opus 4.8",
      "family": "opus",
      "aliases": [],
      "status": "active",
      "retirement": null,
      "replacement": null,
      "context_window": 1000000,
      "max_context_window": null,
      "max_output_tokens": 128000,
      "default_max_tokens": 64000,
      "thinking": {
        "supported": true,
        "adaptive": true,
        "budget_tokens": true,
        "disabled": true,
        "interleaved": true,
        "display": true
      },
      "effort": {
        "levels": [
          "low",
          "medium",
          "high",
          "xhigh",
          "max"
        ],
        "default": "high"
      },
      "sampling": {
        "temperature": false,
        "top_p": false
      },
      "inputs": {
        "image": true,
        "file": true
      },
      "structured_outputs": true,
      "strict_tools": true,
      "context_management": true,
      "conversation": {
        "tool_changes": true,
        "effort_changes": false,